{
  "schema_version": "1.0",
  "time": {"step_seconds": 3600, "timezone": "Asia/Shanghai", "timestamp_meaning": "interval_end"},
  "xaj": {"KC": 0.8, "B": 0.3, "C": 0.15, "IMP": 0.02, "WM": 120, "WUM": 20, "WLM": 60, "SM": 40, "EX": 1.2, "KG": 0.2, "KI": 0.3, "CG": 0.9, "CI": 0.8, "CS": 0.5, "KE": 1, "XE": 0.2},
  "routing": {"dp_by_reach": {"1": 1}, "lag_steps": 0},
  "initial": {"soil_fraction": 0.2, "s_mm": 0, "fr": 0, "qi_m3s": 0, "qg_m3s": 0, "qs_cs_m3s": 0, "qi_cs_m3s": 0, "qg_cs_m3s": 0},
  "warmup_steps": 1,
  "simulation": {"start": "2020-01-01T02:00:00+08:00", "end": "2020-01-01T03:00:00+08:00"}
}
